{
  "$schema": "https://json-schema.org/draft/2020-12/schema",
  "title": "data/reports/index.json",
  "description": "A compact, columnar summary of every report, so the explore page can list, filter and search all of them without loading the report shards. Position n in every column is the same report. Reports are ordered newest first with undated ones last, then by id. The writer rebuilds this file from the shards and refuses any difference.",
  "type": "object",
  "additionalProperties": false,
  "required": [
    "built_at",
    "id_len",
    "total",
    "tables",
    "kev",
    "columns"
  ],
  "properties": {
    "built_at": {
      "description": "The built_at of build.json in the same build. The page compares the two to notice files from different builds.",
      "type": "string",
      "pattern": "^[0-9]{4}-[0-9]{2}-[0-9]{2}T[0-9]{2}:[0-9]{2}:[0-9]{2}Z$"
    },
    "id_len": {
      "description": "How many characters of a SHA-1 report ID the id column keeps.",
      "type": "integer",
      "minimum": 8,
      "maximum": 40
    },
    "total": {
      "description": "The number of reports. Every column has this many entries, and it equals the total length of the report shards.",
      "type": "integer",
      "minimum": 0
    },
    "tables": {
      "description": "Each string that repeats is stored once here.",
      "type": "object",
      "additionalProperties": false,
      "required": [
        "sources",
        "organisations",
        "actors",
        "cves",
        "techniques"
      ],
      "properties": {
        "sources": {
          "description": "Source keys, most used first.",
          "type": "array",
          "items": {
            "$ref": "#/$defs/sourceKey"
          },
          "uniqueItems": true
        },
        "organisations": {
          "description": "Publishing organisations, most used first.",
          "type": "array",
          "items": {
            "$ref": "#/$defs/label"
          },
          "uniqueItems": true
        },
        "actors": {
          "description": "Actor IDs, most used first.",
          "type": "array",
          "items": {
            "$ref": "#/$defs/actorId"
          },
          "uniqueItems": true
        },
        "cves": {
          "description": "CVE IDs, most used first.",
          "type": "array",
          "items": {
            "$ref": "#/$defs/cve"
          },
          "uniqueItems": true
        },
        "techniques": {
          "description": "Technique IDs, most used first.",
          "type": "array",
          "items": {
            "$ref": "#/$defs/techniqueId"
          },
          "uniqueItems": true
        }
      }
    },
    "kev": {
      "description": "Positions in tables.cves of the CVEs that are in the KEV catalogue.",
      "$ref": "#/$defs/positions"
    },
    "columns": {
      "description": "One array per field, each with total entries.",
      "type": "object",
      "additionalProperties": false,
      "required": [
        "id",
        "title",
        "published",
        "organisation",
        "sources",
        "actors",
        "cves",
        "techniques"
      ],
      "properties": {
        "id": {
          "description": "indexId of each report.",
          "type": "array",
          "items": {
            "$ref": "#/$defs/indexId"
          }
        },
        "title": {
          "description": "The report's title.",
          "type": "array",
          "items": {
            "$ref": "#/$defs/label"
          }
        },
        "published": {
          "description": "The publication date, or null when the report is undated. Undated reports come last.",
          "type": "array",
          "items": {
            "$ref": "#/$defs/nullableDate"
          }
        },
        "organisation": {
          "description": "A position in tables.organisations, or null when no source names the publisher.",
          "type": "array",
          "items": {
            "type": [
              "integer",
              "null"
            ],
            "minimum": 0
          }
        },
        "sources": {
          "description": "A bitmask over tables.sources: bit n is set when the source at position n lists the report. Never zero, because every report has a source.",
          "type": "array",
          "items": {
            "type": "integer",
            "minimum": 1
          }
        },
        "actors": {
          "description": "Positions in tables.actors.",
          "type": "array",
          "items": {
            "$ref": "#/$defs/positions"
          }
        },
        "cves": {
          "description": "Positions in tables.cves.",
          "type": "array",
          "items": {
            "$ref": "#/$defs/positions"
          }
        },
        "techniques": {
          "description": "Positions in tables.techniques.",
          "type": "array",
          "items": {
            "$ref": "#/$defs/positions"
          }
        }
      }
    }
  },
  "$defs": {
    "actorId": {
      "description": "An ATT&CK group ID such as G0007, or a lower-case ASCII slug for an actor ATT&CK does not track. The ID is also the actor's file name and URL segment, so it has no colons, slashes or spaces, and it is never 'index'.",
      "type": "string",
      "pattern": "^(?!index$)(G[0-9]{4}|[a-z0-9]+(-[a-z0-9]+)*)$"
    },
    "cve": {
      "description": "A CVE ID in upper case.",
      "type": "string",
      "pattern": "^CVE-[0-9]{4}-[0-9]{4,7}$"
    },
    "label": {
      "description": "Non-empty text with no leading or trailing whitespace and no line breaks.",
      "type": "string",
      "pattern": "^\\S(.*\\S)?$"
    },
    "nullableDate": {
      "description": "A date, or null when none is known.",
      "type": [
        "string",
        "null"
      ],
      "pattern": "^(199[0-9]|2[0-9]{3})-(0[1-9]|1[0-2])-(0[1-9]|[12][0-9]|3[01])$"
    },
    "techniqueId": {
      "description": "An ATT&CK technique or sub-technique ID.",
      "type": "string",
      "pattern": "^T[0-9]{4}(\\.[0-9]{3})?$"
    },
    "sourceKey": {
      "description": "A connector key such as attack or misp, as listed in sources.json. Never a display name.",
      "type": "string",
      "pattern": "^[a-z][a-z0-9-]*$"
    },
    "reportId": {
      "description": "The report's SHA-1 in lower-case hex when one is known, otherwise <source>:<source_id>.",
      "type": "string",
      "pattern": "^([0-9a-f]{40}|[a-z][a-z0-9-]*:\\S+)$"
    },
    "indexId": {
      "description": "A report ID as the index stores it. A SHA-1 digest is cut to the first id_len hex characters, at least 8, which the writer has checked is unique among the digests. Any other ID is kept whole.",
      "type": "string",
      "pattern": "^([0-9a-f]{8,40}|[a-z][a-z0-9-]*:\\S+)$"
    },
    "position": {
      "description": "A position in one of the tables. Zero is the first entry.",
      "type": "integer",
      "minimum": 0
    },
    "positions": {
      "description": "Positions in one table, ascending, each at most once.",
      "type": "array",
      "items": {
        "$ref": "#/$defs/position"
      },
      "uniqueItems": true
    }
  }
}
